{
  "schemaVersion": 1,
  "moduleId": "auth",
  "frontendPackages": ["@mango/auth"],
  "adminIntegration": {
    "aggregateOwner": "@mango/admin",
    "styleEntries": [{ "package": "@mango/auth", "subpath": "./style.css" }]
  },
  "backendStarters": [":mango-auth-starter"],
  "presetMembership": "default"
}
